{
  "notes": "Round 1 of the Tidemark mark: six directions on one idea, **the line the water leaves**. Look at which still reads at 16 px and in the one-colour menu bar, and which sits best beside the wordmark.",
  "brand": {
    "name": "Tidemark",
    "wordmark": "tide[mark]",
    "wordmark_font": "\"Avenir Next\", \"Helvetica Neue\", system-ui, sans-serif",
    "wordmark_weight": 800,
    "tagline": "Every change leaves a line."
  },
  "palette": {
    "light": {
      "background": "#eef3f4",
      "surface": "#f8fbfb",
      "ink": "#12303a",
      "muted": "#6b8189",
      "accent": "#0f8b8d"
    },
    "dark": {
      "background": "#0f1c21",
      "surface": "#18292f",
      "ink": "#e3eef0",
      "muted": "#88a0a7",
      "accent": "#3cc1c3"
    }
  },
  "marks": [
    {
      "id": "M4",
      "name": "Post and line",
      "svg": "<svg xmlns=\"http://www.w3.org/2000/svg\" viewBox=\"0 0 24 24\"><rect x=\"4\" y=\"3\" width=\"3\" height=\"18\" rx=\"1.5\" fill=\"currentColor\" /><rect x=\"17\" y=\"3\" width=\"3\" height=\"18\" rx=\"1.5\" fill=\"currentColor\" /><rect x=\"7\" y=\"10.5\" width=\"10\" height=\"3\" rx=\"1.5\" fill=\"var(--accent)\" /></svg>",
      "reasoning": "Two posts with the level strung between them. The fewest parts and the most legible at 16 px; the accent carries the idea on its own."
    },
    {
      "id": "M2",
      "name": "High-water ring",
      "svg": "<svg xmlns=\"http://www.w3.org/2000/svg\" viewBox=\"0 0 24 24\"><circle cx=\"12\" cy=\"12\" r=\"8.5\" fill=\"none\" stroke=\"currentColor\" stroke-width=\"2.4\" /><rect x=\"2\" y=\"10.8\" width=\"20\" height=\"2.4\" rx=\"1.2\" fill=\"var(--accent)\" /></svg>",
      "reasoning": "A ring with the waterline through it, like a gauge seen head on. The simplest cut, and the one most like a hundred other marks."
    }
  ]
}
